{
  "id": "prLSlfYXlQ8Nmsa8gyVi6PPZUmA=",
  "partitionkey": "{10.0.0.28:8081 -> 10.0.0.2:65473}",
  "source": "ctd.mbta.com/trike-1234",
  "specversion": "1.0",
  "time": "2023-01-29T13:51:54.990000Z",
  "type": "com.mbta.ocs.tsch_tag.v1",
  "data": {
    "counter": 70877,
    "timestamp": "2025-06-06T13:17:37.632951-04:00",
    "transitLine": "B",
    "trainUid": "548386C2",
    "tripUid": "98BB3FCE",
    "consistTags": ["U", "D", "K"],
    "carTags": [
      {
        "carNumber": "1841",
        "carNumberDisplay": "1841",
        "tag": "D"
      }, {
        "carNumber": "1824",
        "carNumberDisplay": "1824",
        "tag": "K"
      }
    ]
  }
}
